{
  "$schema": "https://json-schema.org/draft/2020-12/schema",
  "$id": "urn:openehr:cnf:schema:results:0.1.0",
  "title": "CNF 2.0 party results",
  "description": "The campaign outcomes for one technology profile: per-case×format outcome records (with mandatory citations on skipped/not_applicable), the ambiguity dispositions applied, and provenance (SUT/runner/ixit digest).",
  "type": "object",
  "additionalProperties": false,
  "required": [
    "sut",
    "runner",
    "instrument_status",
    "schedule_release",
    "tech_profile",
    "ixit_digest"
  ],
  "properties": {
    "sut": {
      "description": "The SUT identity. A field the server stated in its ITS-REST System OPTIONS document (specifications/operations/options.yaml, schemas/others/Options.yaml) carries the server's value with source `server`; the operator supplies only the name or version the server did not state (source `operator`). `vendor` and `restapi_specs_version` are present only when the server stated them.",
      "type": "object",
      "additionalProperties": false,
      "required": [
        "name",
        "version"
      ],
      "properties": {
        "name": {
          "type": "object",
          "additionalProperties": false,
          "required": [
            "value",
            "source"
          ],
          "properties": {
            "value": {
              "type": "string",
              "minLength": 1
            },
            "source": {
              "enum": [
                "server",
                "operator"
              ]
            }
          }
        },
        "version": {
          "type": "object",
          "additionalProperties": false,
          "required": [
            "value",
            "source"
          ],
          "properties": {
            "value": {
              "type": "string",
              "minLength": 1
            },
            "source": {
              "enum": [
                "server",
                "operator"
              ]
            }
          }
        },
        "vendor": {
          "type": "object",
          "additionalProperties": false,
          "required": [
            "value",
            "source"
          ],
          "properties": {
            "value": {
              "type": "string",
              "minLength": 1
            },
            "source": {
              "enum": [
                "server"
              ]
            }
          }
        },
        "restapi_specs_version": {
          "type": "object",
          "additionalProperties": false,
          "required": [
            "value",
            "source"
          ],
          "properties": {
            "value": {
              "type": "string",
              "minLength": 1
            },
            "source": {
              "enum": [
                "server"
              ]
            }
          }
        }
      }
    },
    "runner": {
      "type": "object",
      "additionalProperties": false,
      "required": [
        "name",
        "version",
        "verification_pack_status"
      ],
      "properties": {
        "name": {
          "type": "string",
          "minLength": 1
        },
        "version": {
          "type": "string",
          "minLength": 1
        },
        "verification_pack_status": {
          "enum": [
            "passed",
            "not_run",
            "failed"
          ]
        }
      }
    },
    "instrument_status": {
      "enum": [
        "pre-approval",
        "sec-approved"
      ],
      "description": "The approval status of the instrument that wrote this document, derived from its own version: pre-approval for every 0.x version, which the openEHR SEC has not approved, and sec-approved from 1.0.0, which marks that approval."
    },
    "schedule_release": {
      "type": "string",
      "minLength": 1
    },
    "tech_profile": {
      "type": "object",
      "additionalProperties": false,
      "required": [
        "its"
      ],
      "properties": {
        "its": {
          "enum": [
            "its-rest"
          ]
        },
        "formats": {
          "type": "array",
          "items": {
            "enum": [
              "canonical-json",
              "canonical-xml",
              "wt-flat",
              "wt-structured",
              "wt"
            ]
          }
        },
        "source": {
          "enum": [
            "declared",
            "defaulted"
          ],
          "description": "Where the recorded format list came from: `declared` when the party statement's tech_profiles entry for this ITS named it, `defaulted` when no declaration named this ITS and every format the instrument speaks was recorded instead. The recorded list is what the verdict pipeline selects gating records with, so the two carry different claims: a defaulted list keeps a red row in an unlisted format from vanishing behind a pass, and it is not a party's claim about the formats it serves. Absent only in a document written before the member existed, where absence is unknown and never either source."
        }
      }
    },
    "ixit_digest": {
      "type": "string",
      "pattern": "^[0-9a-f]{16}$",
      "description": "The leading 8 bytes of the SHA-256 over the ixit declaration this campaign was driven under, lowercase hex, computed over the document's bytes with nothing canonicalized first. A reader holding that declaration re-derives it with `sha256sum ixit.json | cut -c1-16`."
    },
    "statement_digest": {
      "type": "string",
      "pattern": "^[0-9a-f]{16}$",
      "description": "The leading 8 bytes of the SHA-256 over the party statement this campaign was selected under, lowercase hex, computed over the document's bytes with nothing canonicalized first. A reader holding that statement re-derives it with `sha256sum statement.json | cut -c1-16`, which is what tells one claim from another claim declaring the same its-rest formats. Absent for a campaign no statement selected (selection_basis statement_blind), and absent in a document written before the member existed, where the identity is unknown and never a match."
    },
    "selection_basis": {
      "enum": [
        "statement",
        "statement_blind"
      ],
      "description": "What ISO/IEC 9646 test selection had to select this campaign with: `statement` when a party statement (ICS) was supplied, `statement_blind` when none was. A blind campaign is a sweep of the whole catalogue rather than a party-scoped record — nothing selected the party's option arms, extension routes, claimed capabilities or release floors, and the cases whose failure that absence would manufacture (an unselected arm of a mutually exclusive option_select branch, an extension route no released text governs) are recorded not_applicable with their citation. Absent only in a document written before the member existed, where absence is unknown and never either basis."
    },
    "restapi_specs_version": {
      "type": "string",
      "minLength": 1,
      "description": "The restapi_specs_version member the SUT's System OPTIONS manifest served during the campaign, when that exchange was driven (released OAS system.openapi.yaml Options — every member optional, so absence is normal). An independent confirmation of the statement's declared spec_versions.its_rest, never a source of truth: divergence from the declaration is a static-review finding, not a re-declaration."
    },
    "outcomes": {
      "type": "array",
      "items": {
        "type": "object",
        "additionalProperties": false,
        "required": [
          "case",
          "status",
          "rows_driven",
          "rows_total"
        ],
        "properties": {
          "case": {
            "type": "string",
            "pattern": "^\\S+$"
          },
          "format": {
            "enum": [
              "canonical-json",
              "canonical-xml",
              "wt-flat",
              "wt-structured",
              "wt"
            ]
          },
          "status": {
            "enum": [
              "passed",
              "failed",
              "errored",
              "skipped",
              "not_applicable"
            ]
          },
          "rows_driven": {
            "type": "integer",
            "minimum": 0
          },
          "rows_total": {
            "type": "integer",
            "minimum": 0
          },
          "failing_step": {
            "type": "integer",
            "minimum": 0
          },
          "reason": {
            "type": "string"
          },
          "citation": {
            "type": "string"
          },
          "failed_rows": {
            "type": "array",
            "items": {
              "type": "object",
              "additionalProperties": false,
              "required": [
                "row",
                "step",
                "reason"
              ],
              "properties": {
                "row": {
                  "type": "integer",
                  "minimum": 0
                },
                "step": {
                  "type": "integer",
                  "minimum": 0
                },
                "reason": {
                  "type": "string",
                  "minLength": 1
                }
              }
            }
          },
          "errored_rows": {
            "type": "array",
            "items": {
              "type": "object",
              "additionalProperties": false,
              "required": [
                "row",
                "step",
                "reason"
              ],
              "properties": {
                "row": {
                  "type": "integer",
                  "minimum": 0
                },
                "step": {
                  "type": "integer",
                  "minimum": 0
                },
                "reason": {
                  "type": "string",
                  "minLength": 1
                }
              }
            }
          }
        },
        "allOf": [
          {
            "if": {
              "properties": {
                "status": {
                  "enum": [
                    "skipped",
                    "not_applicable"
                  ]
                }
              },
              "required": [
                "status"
              ]
            },
            "then": {
              "required": [
                "case",
                "status",
                "rows_driven",
                "rows_total",
                "citation"
              ],
              "properties": {
                "citation": {
                  "type": "string",
                  "minLength": 1
                }
              }
            }
          }
        ]
      }
    },
    "measurements": {
      "type": "array",
      "items": {
        "type": "object",
        "additionalProperties": false,
        "required": [
          "case",
          "class",
          "environment",
          "offered_load_sustained",
          "warmup_s",
          "duration_s",
          "operations",
          "verdict"
        ],
        "properties": {
          "case": {
            "type": "string",
            "pattern": "^\\S+$"
          },
          "class": {
            "enum": [
              "POC",
              "S",
              "L",
              "R"
            ]
          },
          "environment": {
            "type": "object",
            "additionalProperties": false,
            "required": [
              "hardware_class",
              "cores",
              "memory_gb",
              "storage_class",
              "topology"
            ],
            "properties": {
              "exclusive_server": {
                "type": "boolean"
              },
              "hardware_class": {
                "type": "string",
                "minLength": 1
              },
              "cores": {
                "type": "integer",
                "minimum": 0
              },
              "memory_gb": {
                "type": "integer",
                "minimum": 0
              },
              "storage_class": {
                "type": "string",
                "minLength": 1
              },
              "topology": {
                "type": "string",
                "minLength": 1
              }
            }
          },
          "offered_load_sustained": {
            "type": "number",
            "minimum": 0.0
          },
          "warmup_s": {
            "type": "integer",
            "minimum": 0
          },
          "duration_s": {
            "type": "integer",
            "minimum": 1
          },
          "operations": {
            "type": "array",
            "minItems": 1,
            "items": {
              "type": "object",
              "additionalProperties": false,
              "required": [
                "operation",
                "requests",
                "errors",
                "latency_ms_p50",
                "latency_ms_p90",
                "latency_ms_p99",
                "hdr_v2_base64"
              ],
              "properties": {
                "operation": {
                  "type": "string",
                  "minLength": 1
                },
                "requests": {
                  "type": "integer",
                  "minimum": 0
                },
                "errors": {
                  "type": "integer",
                  "minimum": 0
                },
                "latency_ms_p50": {
                  "type": "number",
                  "minimum": 0.0
                },
                "latency_ms_p90": {
                  "type": "number",
                  "minimum": 0.0
                },
                "latency_ms_p99": {
                  "type": "number",
                  "minimum": 0.0
                },
                "hdr_v2_base64": {
                  "type": "string",
                  "minLength": 1
                }
              }
            }
          },
          "verdict": {
            "enum": [
              "earned",
              "not-earned"
            ]
          },
          "violations": {
            "type": "array",
            "items": {
              "type": "string",
              "minLength": 1
            }
          },
          "resources": {
            "type": "object",
            "additionalProperties": false,
            "required": [
              "sample_interval_s",
              "containers"
            ],
            "properties": {
              "sample_interval_s": {
                "type": "integer",
                "minimum": 1
              },
              "containers": {
                "type": "array",
                "items": {
                  "type": "object",
                  "additionalProperties": false,
                  "required": [
                    "role",
                    "name",
                    "samples"
                  ],
                  "properties": {
                    "role": {
                      "enum": [
                        "sut",
                        "db"
                      ]
                    },
                    "name": {
                      "type": "string",
                      "minLength": 1
                    },
                    "samples": {
                      "type": "array",
                      "items": {
                        "type": "object",
                        "additionalProperties": false,
                        "required": [
                          "offset_s",
                          "phase",
                          "cpu_pct",
                          "rss_bytes",
                          "blk_read_bytes",
                          "blk_write_bytes",
                          "net_rx_bytes",
                          "net_tx_bytes"
                        ],
                        "properties": {
                          "offset_s": {
                            "type": "integer",
                            "minimum": 0
                          },
                          "phase": {
                            "enum": [
                              "warmup",
                              "measured",
                              "drain"
                            ]
                          },
                          "cpu_pct": {
                            "type": "number",
                            "minimum": 0.0
                          },
                          "rss_bytes": {
                            "type": "integer",
                            "minimum": 0
                          },
                          "blk_read_bytes": {
                            "type": "integer",
                            "minimum": 0
                          },
                          "blk_write_bytes": {
                            "type": "integer",
                            "minimum": 0
                          },
                          "net_rx_bytes": {
                            "type": "integer",
                            "minimum": 0
                          },
                          "net_tx_bytes": {
                            "type": "integer",
                            "minimum": 0
                          }
                        }
                      }
                    }
                  }
                }
              },
              "disk": {
                "type": "object",
                "additionalProperties": false,
                "properties": {
                  "before_scale_seed_bytes": {
                    "type": "integer",
                    "minimum": 0
                  },
                  "after_scale_seed_bytes": {
                    "type": "integer",
                    "minimum": 0
                  },
                  "after_ward_seed_bytes": {
                    "type": "integer",
                    "minimum": 0
                  },
                  "after_window_bytes": {
                    "type": "integer",
                    "minimum": 0
                  },
                  "seed_compositions": {
                    "type": "integer",
                    "minimum": 1
                  }
                }
              }
            }
          }
        }
      }
    },
    "ambiguity_dispositions": {
      "description": "The ambiguity dispositions the campaign applied: one record per option_select register arm the party's ICS declared, in the register's authored order. The arms of one option family are mutually exclusive, so which arm a deployment serves is the ICS's answer and the record says which answer it drove under. Empty for a campaign no statement selected, which declares no arm at all.",
      "type": "array",
      "items": {
        "type": "object",
        "additionalProperties": false,
        "required": [
          "ambiguity"
        ],
        "properties": {
          "ambiguity": {
            "type": "string",
            "pattern": "^AMB-[0-9]+$"
          },
          "option": {
            "type": "string",
            "pattern": "^[a-z0-9_-]+$"
          }
        }
      }
    }
  }
}
